{
  "$schema": "https://json-schema.org/draft/2020-12/schema",
  "type": "object",
  "required": ["version", "title"],
  "properties": {
    "version": {"type": "string", "const": "1.0"},
    "title": {"type": "string"},
    "description": {"type": "string"},
    "extends": {
      "oneOf": [
        {"type": "string"},
        {
          "type": "object",
          "required": ["url"],
          "properties": {
            "url": {"type": "string", "minLength": 1},
            "tag": {"type": "string"}
          },
          "additionalProperties": false
        }
      ]
    },
    "groups": {
      "type": "object",
      "additionalProperties": {
        "type": "object",
        "required": ["title", "description", "templates"],
        "properties": {
          "title": {"type": "string"},
          "description": {"type": "string"},
          "templates": {
            "type": "array",
            "items": {"type": "string"},
            "minItems": 1
          },
          "hidden": {"type": "boolean", "default": false}
        },
        "additionalProperties": false
      }
    },
    "templates": {
      "type": "object",
      "additionalProperties": {
        "type": "object",
        "required": ["path", "title", "description"],
        "properties": {
          "path": {"type": "string"},
          "title": {"type": "string"},
          "description": {"type": "string"},
          "hidden": {"type": "boolean", "default": false}
        },
        "additionalProperties": false
      }
    },
    "config": {
      "type": "object",
      "properties": {
        "versions": {
          "type": "object",
          "additionalProperties": {"type": "string"}
        },
        "renderer": {
          "type": "string",
          "minLength": 1
        },
        "min_version": {
          "type": "string",
          "minLength": 1
        }
      },
      "additionalProperties": false
    }
  },
  "additionalProperties": false,
  "allOf": [
    {
      "if": {
        "anyOf": [
          {"not": {"required": ["extends"]}},
          {"properties": {"extends": {"const": ""}}}
        ]
      },
      "then": {
        "required": ["templates"],
        "properties": {"templates": {"minProperties": 1}}
      }
    }
  ]
}
